{"artifact_digest":"6a0fc59a12011f818b3953c8ad51ac822a711995578a05e755bd3fd44ae62dc4","claim_ceiling":"local-replay","content_digest":"646780a7c4c0f4e9e28630bc4b0b5545495f375b55a338d05d3f8ded66a255f6","evaluation_scope":"target_commit=638f922bab476602d423fd28a6be35aaffbaa9fb;python-contract-and-boundary-tests-only","expected_result_digest":"124796b57d42e35a371806f6b825e2e954e34f593574fc5d0bdad6cca7829e30","instances":[{"completed_at":"2026-09-09T22:19:18Z","environment_digest":"7bc225788d63f5cf0d11e22f5b0474c705d096fe4cb12781fd33e7848c1658a7","instance_id":"justai-lq-20260909-221725-a","machine_digest":"7306b3d887526edacd042b44af0233ac6d03f20c467bfa02d717e20fad6cf40d","observed_result_digest":"124796b57d42e35a371806f6b825e2e954e34f593574fc5d0bdad6cca7829e30","output_digest":"be32612f0b464a982be6fa905cc8bfc69b0c4de8bcc70369d88b6fc543f48167","runner_digest":"c9ce39f416df48dadb7300498f76943ae242dc185015e74e0cd3aa18bc50b16b","started_at":"2026-09-09T22:19:17Z","status":"pass"},{"completed_at":"2026-09-09T22:20:45Z","environment_digest":"7bc225788d63f5cf0d11e22f5b0474c705d096fe4cb12781fd33e7848c1658a7","instance_id":"justai-lq-20260909-221725-b","machine_digest":"cb8956573153c8dd392be72ac30634b7783f04c9409d15bc4fa60b4572bbaf94","observed_result_digest":"124796b57d42e35a371806f6b825e2e954e34f593574fc5d0bdad6cca7829e30","output_digest":"edd5d0f0ec8188f568af6637a5359453e587ec675c1b37c94d690f41361fe2cb","runner_digest":"c9ce39f416df48dadb7300498f76943ae242dc185015e74e0cd3aa18bc50b16b","started_at":"2026-09-09T22:20:41Z","status":"pass"},{"completed_at":"2026-09-09T22:21:46Z","environment_digest":"7bc225788d63f5cf0d11e22f5b0474c705d096fe4cb12781fd33e7848c1658a7","instance_id":"justai-lq-20260909-221725-c","machine_digest":"056734ce3f12a2d8d1c091e955de1ba5c90ddaf37fca4ec2cd1a6438f24d4382","observed_result_digest":"124796b57d42e35a371806f6b825e2e954e34f593574fc5d0bdad6cca7829e30","output_digest":"e078eef68ed823a6910f79573f6a4873a9dfd586fb40bac69a999ef93192b5fe","runner_digest":"c9ce39f416df48dadb7300498f76943ae242dc185015e74e0cd3aa18bc50b16b","started_at":"2026-09-09T22:21:46Z","status":"pass"}],"record_id":"gcp-local-quorum-20260909-221725","schema":"justai.local_quorum.v1","signature_refs":[{"instance_id":"justai-lq-20260909-221725-a","key_id":"justai-lq-20260909-221725-a-ephemeral-ed25519","principal_id":"local-operator","public_key":"b140640db3141bcb91bfc9bf4282771cc11535c68728a0f3e13f5c7037c7c4ce","purpose":"instance:justai-lq-20260909-221725-a","role":"instance","signature":"efeecb74283e3a03074e20c449f674f41228dd9ff98ce0712f69c36c91c8063edbe5e2d80b0f24693e7af14940eb7a6a064c24689015d1c7262cc6f50c4ce305"},{"instance_id":"justai-lq-20260909-221725-b","key_id":"justai-lq-20260909-221725-b-ephemeral-ed25519","principal_id":"local-operator","public_key":"16bff394c7364e9cb576fa63d8a038dd8a25fed1c2f0c42c929b0fc2265b5218","purpose":"instance:justai-lq-20260909-221725-b","role":"instance","signature":"ef182701e8ab176494486048ca3b1ccf3b7ef79536a8d02aabb84fc0b2af46b36a17a766913e27f2c9843a7d6749532b2bd931c2511ec9df9cf19c796c3c6c00"},{"instance_id":"justai-lq-20260909-221725-c","key_id":"justai-lq-20260909-221725-c-ephemeral-ed25519","principal_id":"local-operator","public_key":"9782c64975f8a63dcc28a817beceb9187e8ce6761c52a526286e4a77262f402d","purpose":"instance:justai-lq-20260909-221725-c","role":"instance","signature":"23c17b0c790e936cfa56824515898698138d0638f612e3b93efd2712fb651465f626cca7e829ebd6e2aede6486a80a8ab01e60030be26d84a9abc4882399f705"}],"state_slice":"justai-local-quorum-v1","status":"Verified","verification_mode":"local-quorum"}
